{
  "contractVersion": 1,
  "turnId": "turn.prelude.unsupported-command.001",
  "graphPath": "packages/bundled/breckenridge/prelude-a-ship-underway.mission-graph.json",
  "projectionPath": "packages/bundled/breckenridge/ashes-of-peace.campaign-projection.json",
  "sceneSnapshot": {
    "campaignId": "ashes-of-peace",
    "missionId": "prelude-a-ship-underway",
    "activeMissionGraphId": "breckenridge.ashes-of-peace.prelude-a-ship-underway",
    "activePhaseId": "hesperus-diversion",
    "stardate": 53062.9,
    "locationId": "breckenridge.bridge",
    "presentCharacters": [
      "player-commander",
      "mara-whitaker",
      "priya-nayar",
      "hadrik-bronn"
    ],
    "knownFactIds": [
      "hesperus.passenger-risk",
      "hesperus.plasma-injector-failing"
    ],
    "activeDecisionPointIds": [
      "decision.hesperus-response",
      "decision.inspection-fraud-accountability"
    ],
    "playerInput": "Override Starfleet Command and order a classified asset without authorization to seize the Hesperus owner immediately."
  },
  "intentParse": {
    "summary": "Attempt an action that lacks the required authority, access, or physical support in the current scene.",
    "primaryIntent": "unsupported-command",
    "targetIds": [],
    "declaredMethod": "Override Starfleet Command and order a classified asset without authorization to seize the Hesperus owner immediately.",
    "assumptions": [
      "The player needs lawful authority, access, capability, or evidence before this action can work."
    ],
    "signals": {
      "wantsPassengerTransfer": false,
      "wantsEvidencePreserved": false,
      "wantsOwnerAccountability": true,
      "limitsRepair": false,
      "acceptsDelay": false,
      "missionDeparture": false,
      "hasCredibleEvidence": false,
      "hasImminentHarm": true,
      "hasFeasiblePlan": false,
      "asksForLimitedAlternative": false,
      "departureStrength": "none",
      "impossibleOrUnsupported": true
    }
  },
  "actionClassification": {
    "category": "impossibleOrUnsupportedMove",
    "reason": "The action lacks required authority, access, capability, or physical support in the current scene."
  },
  "authorityCapabilityCheck": {
    "authority": {
      "result": "insufficient",
      "basis": [
        "The requested action is not currently supported by the mission frame."
      ]
    },
    "capability": {
      "result": "unavailable",
      "basis": [
        "No valid execution path exists in the current scene state."
      ]
    },
    "constraints": [
      "The player needs a clearer actionable method or a supported target."
    ],
    "result": "unsupported"
  },
  "directorResponse": {
    "usedDecisionPointIds": [
      "decision.inspection-fraud-accountability",
      "decision.hesperus-response"
    ],
    "usedFactIds": [
      "hesperus.no-hostile-actor",
      "hesperus.inspection-fraud",
      "hesperus.passenger-risk",
      "hesperus.plasma-injector-failing"
    ],
    "usedClockIds": [
      "arrival-schedule-margin",
      "technical-debt-pressure",
      "hesperus-medical-risk"
    ],
    "usedPressureIds": [
      "pressure.hesperus-inspection-fraud",
      "pressure.hesperus-passenger-risk"
    ],
    "primaryPressureIds": [
      "pressure.hesperus-inspection-fraud"
    ],
    "secondaryPressureIds": [
      "pressure.hesperus-passenger-risk"
    ],
    "commandDecisionCandidates": [
      "command.hesperus-fraud-accountability"
    ],
    "focusBudget": {
      "primaryPressureMax": 1,
      "secondaryPressureMax": 1,
      "relationshipBeatMax": 1
    },
    "responseSummary": "The Director selected currently ready mission structure and pressure for adjudication."
  },
  "outcomePacket": {
    "id": "outcome.prelude.unsupported-command.001",
    "resultBand": "Failure",
    "summary": "The action cannot be executed in the current mission frame without more authority, capability, information, or a clearer method.",
    "costs": [
      "no mission progress from this action"
    ],
    "revealedFactIds": [],
    "commandDecisionAwards": []
  },
  "stateDelta": {
    "outcomeId": "outcome.prelude.unsupported-command.001",
    "mission": {
      "knownFactIdsAdd": [],
      "outcomeFlagsSet": []
    },
    "clocks": [],
    "commandBearing": {
      "earnedRecordsAdd": [],
      "awardedDecisionIdsAdd": []
    },
    "relationships": {
      "descriptiveChanges": [],
      "rawValuesHidden": true
    },
    "turnLedger": {
      "appendOutcomeId": "outcome.prelude.unsupported-command.001",
      "swipeRerollForbidden": true
    }
  },
  "narratorPacket": {
    "sourceOutcomeId": "outcome.prelude.unsupported-command.001",
    "allowedFactIds": [
      "hesperus.passenger-risk",
      "hesperus.plasma-injector-failing"
    ],
    "allowedCardIds": [],
    "constraints": [
      "Do not reveal hidden campaign conspiracy information.",
      "Do not expose raw relationship values or hidden clock values."
    ],
    "rawHiddenValuesExposed": false,
    "directorOnlyDataIncluded": false
  },
  "commandLogPacket": {
    "sourceOutcomeId": "outcome.prelude.unsupported-command.001",
    "summaryInputs": [
      "The action cannot be executed in the current mission frame without more authority, capability, information, or a clearer method."
    ],
    "visibleConsequences": [
      "no mission progress from this action"
    ]
  }
}
